Name	Protein identifier	Contig id	Start	Stop	Strand	Gene symbol	Sequence name	Scope	Element type	Element subtype	Class	Subclass	Method	Target length	Reference sequence length	% Coverage of reference sequence	% Identity to reference sequence	Alignment length	Accession of closest sequence	Name of closest sequence	HMM id	HMM description
VA61_2022	NA	1	369761	370873	+	iroB	salmochelin biosynthesis C-glycosyltransferase IroB	plus	VIRULENCE	VIRULENCE	NA	NA	BLASTX	371	371	100.00	92.99	371	EOW04219.1	salmochelin biosynthesis C-glycosyltransferase IroB	NA	NA
VA61_2022	NA	1	371018	374662	+	iroC	salmochelin/enterobactin export ABC transporter IroC	plus	VIRULENCE	VIRULENCE	NA	NA	BLASTX	1215	1219	99.75	90.62	1216	AUH19662.1	salmochelin/enterobactin export ABC transporter IroC	NA	NA
VA61_2022	NA	1	377096	379267	-	iroN	siderophore salmochelin receptor IroN	plus	VIRULENCE	VIRULENCE	NA	NA	BLASTX	724	725	100.00	95.03	725	AAN76093.1	siderophore salmochelin receptor IroN	NA	NA
VA61_2022	NA	2	92428	93600	+	oqxA	multidrug efflux RND transporter periplasmic adaptor subunit OqxA	core	AMR	AMR	PHENICOL/QUINOLONE	PHENICOL/QUINOLONE	BLASTX	391	391	100.00	91.30	391	WP_002914189.1	multidrug efflux RND transporter periplasmic adaptor subunit OqxA	NA	NA
VA61_2022	NA	2	93627	96776	+	oqxB	multidrug efflux RND transporter permease subunit OqxB	core	AMR	AMR	PHENICOL/QUINOLONE	PHENICOL/QUINOLONE	BLASTX	1050	1050	100.00	96.38	1050	WP_012967412.1	multidrug efflux RND transporter permease subunit OqxB9	NA	NA
VA61_2022	NA	8	56667	57095	-	silE	silver-binding protein SilE	plus	STRESS	METAL	SILVER	SILVER	EXACTX	143	143	100.00	100.00	143	AAD11743.1	silver-binding protein SilE	NA	NA
VA61_2022	NA	8	57349	58821	-	silS	copper/silver sensor histidine kinase SilS	plus	STRESS	METAL	COPPER/SILVER	COPPER/SILVER	BLASTX	491	491	100.00	97.76	491	SPD96882.1	copper/silver sensor histidine kinase SilS	NA	NA
VA61_2022	NA	8	58817	59494	-	silR	copper/silver response regulator transcription factor SilR	plus	STRESS	METAL	COPPER/SILVER	COPPER/SILVER	BLASTX	226	226	100.00	98.23	226	SPD96883.1	copper/silver response regulator transcription factor SilR	NA	NA
VA61_2022	NA	8	59684	61066	+	silC	Cu(+)/Ag(+) efflux RND transporter outer membrane channel SilC	plus	STRESS	METAL	COPPER/SILVER	COPPER/SILVER	BLASTX	461	461	100.00	98.26	461	SPD96884.1	Cu(+)/Ag(+) efflux RND transporter outer membrane channel SilC	NA	NA
VA61_2022	NA	8	61098	61448	+	silF	Cu(+)/Ag(+) efflux RND transporter periplasmic metallochaperone SilF	plus	STRESS	METAL	COPPER/SILVER	COPPER/SILVER	BLASTX	117	117	100.00	99.15	117	KGL71342.1	Cu(+)/Ag(+) efflux RND transporter periplasmic metallochaperone SilF	NA	NA
VA61_2022	NA	8	61565	62854	+	silB	Cu(+)/Ag(+) efflux RND transporter periplasmic adaptor subunit SilB	plus	STRESS	METAL	COPPER/SILVER	COPPER/SILVER	BLASTX	430	430	100.00	98.37	430	AAD11748.1	Cu(+)/Ag(+) efflux RND transporter periplasmic adaptor subunit SilB	NA	NA
VA61_2022	NA	8	62868	66011	+	silA	Cu(+)/Ag(+) efflux RND transporter permease subunit SilA	plus	STRESS	METAL	COPPER/SILVER	COPPER/SILVER	BLASTX	1048	1048	100.00	99.43	1048	AAD11749.1	Cu(+)/Ag(+) efflux RND transporter permease subunit SilA	NA	NA
VA61_2022	NA	8	66639	69107	+	silP	Ag(+)-translocating P-type ATPase SilP	plus	STRESS	METAL	SILVER	SILVER	BLASTX	823	824	100.00	98.42	824	AAD11750.1	Ag(+)-translocating P-type ATPase SilP	NA	NA
VA61_2022	NA	8	71092	72906	+	pcoA	multicopper oxidase PcoA	plus	STRESS	METAL	COPPER	COPPER	BLASTX	605	605	100.00	99.83	605	CAA58525.1	multicopper oxidase PcoA	NA	NA
VA61_2022	NA	8	72915	73802	+	pcoB	copper-binding protein PcoB	plus	STRESS	METAL	COPPER	COPPER	EXACTX	296	296	100.00	100.00	296	CAA58526.1	copper-binding protein PcoB	NA	NA
VA61_2022	NA	8	73845	74222	+	pcoC	copper resistance system metallochaperone PcoC	plus	STRESS	METAL	COPPER	COPPER	EXACTX	126	126	100.00	100.00	126	CAA58527.1	copper resistance system metallochaperone PcoC	NA	NA
VA61_2022	NA	8	74230	75156	+	pcoD	copper resistance inner membrane protein PcoD	plus	STRESS	METAL	COPPER	COPPER	EXACTX	309	309	100.00	100.00	309	CAA58528.1	copper resistance inner membrane protein PcoD	NA	NA
VA61_2022	NA	8	75214	75891	+	pcoR	copper response regulator transcription factor PcoR	plus	STRESS	METAL	COPPER	COPPER	EXACTX	226	226	100.00	100.00	226	CAA58529.1	copper response regulator transcription factor PcoR	NA	NA
VA61_2022	NA	8	75891	77288	+	pcoS	copper resistance membrane spanning protein PcoS	plus	STRESS	METAL	COPPER	COPPER	BLASTX	466	466	100.00	99.36	466	CAA58530.1	copper resistance membrane spanning protein PcoS	NA	NA
VA61_2022	NA	8	77509	77940	+	pcoE	copper resistance system metallochaperone PcoE	plus	STRESS	METAL	COPPER	COPPER	BLASTX	144	144	100.00	92.36	144	CAA58532.1	copper resistance system metallochaperone PcoE	NA	NA
VA61_2022	NA	10	112641	113063	-	fosA	FosA/FosA2 family fosfomycin resistance glutathione transferase	core	AMR	AMR	FOSFOMYCIN	FOSFOMYCIN	BLASTX	141	141	100.00	95.74	141	WP_038415208.1	fosfomycin resistance glutathione transferase FosA	NA	NA
VA61_2022	NA	14	64134	64367	-	merE	broad-spectrum mercury transporter MerE	plus	STRESS	METAL	MERCURY	MERCURY	EXACTX	78	78	100.00	100.00	78	AAC38236.1	broad-spectrum mercury transporter MerE	NA	NA
VA61_2022	NA	14	64367	64729	-	merD	mercury resistance co-regulator MerD	plus	STRESS	METAL	MERCURY	MERCURY	BLASTX	121	121	100.00	98.35	121	AAC38221.1	mercury resistance co-regulator MerD	NA	NA
VA61_2022	NA	14	66392	66634	-	merF	mercury resistance system transport protein MerF	plus	STRESS	METAL	MERCURY	MERCURY	EXACTX	81	81	100.00	100.00	81	ABA25986.1	mercury resistance system transport protein MerF	NA	NA
VA61_2022	NA	14	66643	66912	-	merP	mercury resistance system periplasmic binding protein MerP	plus	STRESS	METAL	MERCURY	MERCURY	BLASTX	90	91	98.90	93.33	90	AAA98223.1	mercury resistance system periplasmic binding protein MerP	NA	NA
VA61_2022	NA	14	66931	67278	-	merT	mercuric transport protein MerT	plus	STRESS	METAL	MERCURY	MERCURY	BLASTX	116	116	100.00	93.97	116	AAA98222.1	mercuric transport protein MerT	NA	NA
VA61_2022	NA	14	67350	67781	+	merR	mercury resistance transcriptional regulator MerR	plus	STRESS	METAL	MERCURY	MERCURY	BLASTX	144	144	100.00	94.44	144	AAC38229.1	mercury resistance transcriptional regulator MerR	NA	NA
VA61_2022	NA	15	19302	20444	-	blaACT-17	cephalosporin-hydrolyzing class C beta-lactamase ACT-17	core	AMR	AMR	BETA-LACTAM	CEPHALOSPORIN	ALLELEX	381	381	100.00	100.00	381	WP_017694683.1	cephalosporin-hydrolyzing class C beta-lactamase ACT-17	NA	NA
VA61_2022	NA	17	68880	69755	+	fieF	CDF family cation-efflux transporter FieF	plus	STRESS	METAL	NA	NA	BLASTX	292	300	97.33	91.10	292	BAE77395.1	CDF family cation-efflux transporter FieF	NA	NA
VA61_2022	NA	25	19154	20032	-	blaKPC-2	carbapenem-hydrolyzing class A beta-lactamase KPC-2	core	AMR	AMR	BETA-LACTAM	CARBAPENEM	ALLELEX	293	293	100.00	100.00	293	WP_004199234.1	carbapenem-hydrolyzing class A beta-lactamase KPC-2	NA	NA
VA61_2022	NA	25	20257	20826	-	blaTEM	TEM family class A beta-lactamase	core	AMR	AMR	BETA-LACTAM	BETA-LACTAM	PARTIALX	190	286	66.43	98.95	190	WP_015379489.1	inhibitor-resistant broad-spectrum class A beta-lactamase TEM-34	NA	NA
VA61_2022	NA	29	82	924	-	aadA16	ANT(3'')-Ia family aminoglycoside nucleotidyltransferase AadA16	core	AMR	AMR	AMINOGLYCOSIDE	STREPTOMYCIN	EXACTX	281	281	100.00	100.00	281	WP_001749984.1	ANT(3'')-Ia family aminoglycoside nucleotidyltransferase AadA16	NA	NA
VA61_2022	NA	29	1108	1578	-	dfrA27	trimethoprim-resistant dihydrofolate reductase DfrA27	core	AMR	AMR	TRIMETHOPRIM	TRIMETHOPRIM	EXACTX	157	157	100.00	100.00	157	WP_001749985.1	trimethoprim-resistant dihydrofolate reductase DfrA27	NA	NA
VA61_2022	NA	29	1714	2163	-	arr-3	NAD(+)--rifampin ADP-ribosyltransferase Arr-3	core	AMR	AMR	RIFAMYCIN	RIFAMYCIN	EXACTX	150	150	100.00	100.00	150	WP_001749986.1	NAD(+)--rifampin ADP-ribosyltransferase Arr-3	NA	NA
VA61_2022	NA	29	2263	2814	-	aac(6')-Ib-cr5	fluoroquinolone-acetylating aminoglycoside 6'-N-acetyltransferase AAC(6')-Ib-cr5	core	AMR	AMR	AMINOGLYCOSIDE/QUINOLONE	AMIKACIN/KANAMYCIN/QUINOLONE/TOBRAMYCIN	ALLELEX	184	184	100.00	100.00	184	WP_063840321.1	fluoroquinolone-acetylating aminoglycoside 6'-N-acetyltransferase AAC(6')-Ib-cr5	NA	NA
VA61_2022	NA	30	2	745	+	pcoS	copper resistance membrane spanning protein PcoS	plus	STRESS	METAL	COPPER	COPPER	PARTIAL_CONTIG_ENDX	248	466	53.22	97.18	248	CAA58530.1	copper resistance membrane spanning protein PcoS	NA	NA
VA61_2022	NA	33	193	834	+	qnrB6	quinolone resistance pentapeptide repeat protein QnrB6	core	AMR	AMR	QUINOLONE	QUINOLONE	ALLELEX	214	214	100.00	100.00	214	WP_001749994.1	quinolone resistance pentapeptide repeat protein QnrB6	NA	NA
VA61_2022	NA	37	659	2275	-	mcr-9.1	phosphoethanolamine--lipid A transferase MCR-9.1	plus	AMR	AMR	COLISTIN	COLISTIN	ALLELEX	539	539	100.00	100.00	539	AYW01299.1	phosphoethanolamine--lipid A transferase MCR-9.1	NA	NA
VA61_2022	NA	48	28	864	-	sul1	sulfonamide-resistant dihydropteroate synthase Sul1	core	AMR	AMR	SULFONAMIDE	SULFONAMIDE	EXACTX	279	279	100.00	100.00	279	WP_000259031.1	sulfonamide-resistant dihydropteroate synthase Sul1	NA	NA
VA61_2022	NA	48	861	1205	-	qacEdelta1	quaternary ammonium compound efflux SMR transporter QacE delta 1	core	STRESS	BIOCIDE	QUATERNARY AMMONIUM	QUATERNARY AMMONIUM	ALLELEX	115	115	100.00	100.00	115	WP_000679427.1	quaternary ammonium compound efflux SMR transporter QacE delta 1	NA	NA
